{
  "format": "open-values-challenge-set",
  "version": "0.1.0",
  "standard": "open-values-standard",
  "updated": "2026-08-14",
  "purpose": "C13 seed data for algorithmic anti-echo-chamber behavior: opposite-view rankings, sourced steelman facts, and instance challenge defaults.",
  "principles": [
    "challenge is calm and dismissible",
    "opposite-view rankings are values-relative, not truth claims",
    "steelman facts must use existing sourced criteria evidence",
    "data generation alone must not decide app presentation"
  ],
  "algorithms": [
    {
      "id": "opposite-view",
      "label": "Opposite view",
      "summary": "Rank the same category under an explicit opposite weighting and show the strongest honest case for that result.",
      "inputs": [
        "category",
        "userView.weights",
        "oppositeView.weights"
      ],
      "outputs": [
        "userView.expectedTop",
        "oppositeView.expectedTop",
        "oppositeView.sourceTag"
      ],
      "mustNot": [
        "Do not imply the opposite pick is objectively better.",
        "Do not store or infer a user's private values."
      ]
    },
    {
      "id": "steelman",
      "label": "Steelman",
      "summary": "For the user's likely top pick, surface the lowest-scoring sourced weakness on an axis the view weights at 2 or below.",
      "inputs": [
        "category",
        "userView.expectedTop",
        "steelman.axis",
        "steelman.sourceTag"
      ],
      "outputs": [
        "steelman.framing"
      ],
      "mustNot": [
        "Do not frame the weakness as a gotcha.",
        "Do not use unsourced criticism."
      ]
    }
  ],
  "instances": [
    {
      "id": "conscious-consuming",
      "label": "Conscious Consuming",
      "role": "reference-consumption-instance",
      "challengeDefault": "available",
      "surfaces": [
        "verdict",
        "category",
        "entry"
      ],
      "note": "The reference app can consume these contracts later; this file does not mandate app UI."
    },
    {
      "id": "kosplora",
      "label": "Kosplora",
      "role": "flagship-learning-instance",
      "challengeDefault": "prominent",
      "surfaces": [
        "learning-result",
        "resource-detail",
        "pathway"
      ],
      "config": {
        "preferAxes": [
          "openness",
          "depth",
          "accessibility",
          "calm"
        ],
        "challengePrompt": "See a credible learning path that pushes against this preference.",
        "mustNot": [
          "Do not gamify challenge exposure.",
          "Do not rank controversy above evidence quality."
        ]
      }
    },
    {
      "id": "socrates-colosseum",
      "label": "Socrates Colosseum",
      "role": "future-structured-dissent-instance",
      "status": "format-seed",
      "challengeDefault": "primary",
      "surfaces": [
        "position",
        "claim",
        "source-set"
      ],
      "config": {
        "preferAxes": [
          "source-quality",
          "opposing-view",
          "claim-limits"
        ],
        "challengePrompt": "Read the strongest sourced version of the other position.",
        "mustNot": [
          "Do not publish unsourced claims.",
          "Do not count attention as agreement."
        ]
      }
    }
  ],
  "cases": [
    {
      "id": "ai-assistants-open-local-vs-managed-safety",
      "category": "ai-assistants",
      "label": "Open/local AI assistant versus managed safety",
      "reads": "The strongest case the other way: ChatGPT gives broad access and a managed safety program.",
      "userView": {
        "label": "Privacy and openness first",
        "weights": {
          "privacy": 5,
          "transparency": 5,
          "openness": 5,
          "safety": 2,
          "accessibility": 1
        },
        "expectedTop": "jan-ai"
      },
      "oppositeView": {
        "label": "Managed safety and broad access first",
        "weights": {
          "privacy": 1,
          "transparency": 1,
          "openness": 1,
          "safety": 5,
          "accessibility": 5
        },
        "expectedTop": "chatgpt",
        "sourceTag": "ai-assistants/chatgpt/accessibility"
      },
      "steelman": {
        "forEntity": "jan-ai",
        "axis": "safety",
        "sourceTag": "ai-assistants/jan-ai/safety",
        "framing": "The strongest counterpoint is safety: local deployments inherit safety behavior from the chosen model and user configuration."
      }
    },
    {
      "id": "learning-depth-vs-accessibility",
      "category": "learning-resources",
      "label": "Deep expert reference versus accessibility-first library access",
      "reads": "The strongest case the other way: NLS is built for readers who need accessible formats.",
      "userView": {
        "label": "Depth and open scholarship first",
        "weights": {
          "educational": 5,
          "openness": 5,
          "depth": 5,
          "accessibility": 1,
          "calm": 5,
          "economical": 3
        },
        "expectedTop": "sep"
      },
      "oppositeView": {
        "label": "Accessibility and ease first",
        "weights": {
          "educational": 2,
          "openness": 1,
          "depth": 1,
          "accessibility": 5,
          "calm": 1,
          "economical": 1
        },
        "expectedTop": "nls",
        "sourceTag": "learning-resources/nls/accessibility"
      },
      "steelman": {
        "forEntity": "sep",
        "axis": "accessibility",
        "sourceTag": "learning-resources/sep/accessibility",
        "framing": "The strongest counterpoint is accessibility: the encyclopedia is free and structured, but its scholarly prose assumes background knowledge."
      }
    },
    {
      "id": "password-managers-local-control-vs-easy-audited-default",
      "category": "password-managers",
      "label": "Local control versus easier audited default",
      "reads": "The strongest case the other way: Bitwarden is easier for most people to use and audit.",
      "userView": {
        "label": "Local control and open source first",
        "weights": {
          "privacy": 5,
          "transparency": 4,
          "openness": 5,
          "security": 5,
          "accessibility": 1
        },
        "expectedTop": "keepassxc"
      },
      "oppositeView": {
        "label": "Ease and broad usability first",
        "weights": {
          "privacy": 1,
          "transparency": 1,
          "openness": 1,
          "security": 2,
          "accessibility": 5
        },
        "expectedTop": "bitwarden",
        "sourceTag": "password-managers/bitwarden/security"
      },
      "steelman": {
        "forEntity": "keepassxc",
        "axis": "accessibility",
        "sourceTag": "password-managers/keepassxc/accessibility",
        "framing": "The strongest counterpoint is usability: manual vault sync and backup make KeePassXC less effortless than cloud managers."
      }
    },
    {
      "id": "vpn-minimal-data-vs-free-tier-access",
      "category": "vpn",
      "label": "Minimal data collection versus free-tier access",
      "reads": "The strongest case the other way: Proton VPN gives people a no-cost way to start.",
      "userView": {
        "label": "Privacy and transparency first",
        "weights": {
          "privacy": 5,
          "transparency": 5,
          "openness": 4,
          "jurisdiction": 4,
          "accessibility": 1
        },
        "expectedTop": "mullvad"
      },
      "oppositeView": {
        "label": "Ease and availability first",
        "weights": {
          "privacy": 1,
          "transparency": 1,
          "openness": 1,
          "jurisdiction": 1,
          "accessibility": 5
        },
        "expectedTop": "proton-vpn",
        "sourceTag": "vpn/proton-vpn/accessibility"
      },
      "steelman": {
        "forEntity": "mullvad",
        "axis": "accessibility",
        "sourceTag": "vpn/mullvad/accessibility",
        "framing": "The strongest counterpoint is access: Mullvad is simple and privacy-preserving, but it has no free tier."
      }
    },
    {
      "id": "banking-convenience-vs-mission-banking",
      "category": "banking",
      "label": "Convenient everyday banking versus mission and climate banking",
      "reads": "The strongest case the other way: Triodos publishes a fossil-fuel position, and Nationwide argues from the shape of its treasury book.",
      "userView": {
        "label": "Low-friction everyday banking first",
        "weights": {
          "environment": 1,
          "ethics": 1,
          "transparency": 1,
          "fees": 5,
          "accessibility": 5,
          "complaints": 1
        },
        "expectedTop": "nationwide-bs"
      },
      "oppositeView": {
        "label": "Climate and mission banking first",
        "weights": {
          "environment": 5,
          "ethics": 5,
          "transparency": 4,
          "fees": 1,
          "accessibility": 1,
          "complaints": 1
        },
        "expectedTop": "triodos",
        "sourceTag": "banking/triodos/environment"
      },
      "steelman": {
        "forEntity": "nationwide-bs",
        "axis": "environment",
        "sourceTag": "banking/nationwide-bs/environment",
        "framing": "The strongest counterpoint is what is published: Nationwide infers its low fossil-fuel exposure from what its treasury holds, rather than stating a lending exclusion."
      }
    },
    {
      "id": "news-primary-records-vs-independent-investigation",
      "category": "news-sources",
      "label": "Primary official records versus independent investigative reporting",
      "reads": "The strongest case the other way: ProPublica brings independent reporting, not just records.",
      "userView": {
        "label": "Primary records and document depth first",
        "weights": {
          "independence": 0,
          "transparency": 5,
          "nonprofit": 0,
          "depth": 5,